{"artifacts":[{"contentHash":"sha256:cf4ea3ef1e6bd128dc5ade31fa27ce58a2533a255e3019fc88ea2db7f0279f13","path":"/Users/ev/Projects/mihver/.project/run-bundles/authorization-ledger-v1c-r3-architecture-v7/evidence/shadow-council-packet-seat-anthropic-cf4ea3ef1e6bd128dc5ade31fa27ce58a2533a255e3019fc88ea2db7f0279f13.json"},{"contentHash":"sha256:dabd7a2f550358c0f124322505c1503e3b26a766716f09d15981f070391dc190","path":"/Users/ev/Projects/mihver/.project/run-bundles/authorization-ledger-v1c-r3-architecture-v7/evidence/shadow-council-packet-seat-google-dabd7a2f550358c0f124322505c1503e3b26a766716f09d15981f070391dc190.json"},{"contentHash":"sha256:03f88141164e74e2777414dc4d9cfbd174b29039c55501c66ee1fb0885d96653","path":"/Users/ev/Projects/mihver/.project/run-bundles/authorization-ledger-v1c-r3-architecture-v7/evidence/shadow-council-packet-seat-openai-03f88141164e74e2777414dc4d9cfbd174b29039c55501c66ee1fb0885d96653.json"},{"contentHash":"sha256:ac8aee491110e724fb8633452dfdedb0236db565c04a5be83993f0c6433c59b1","path":"/Users/ev/Projects/mihver/.project/run-bundles/authorization-ledger-v1c-r3-architecture-v7/evidence/shadow-council-packet-seat-openai-ac8aee491110e724fb8633452dfdedb0236db565c04a5be83993f0c6433c59b1.json"},{"contentHash":"sha256:5ac292de1187d29e9d7e2d6d4921ce1e94b41c4332aa10abefa36de3ba37d87f","path":"/Users/ev/Projects/mihver/.project/run-bundles/authorization-ledger-v1c-r3-architecture-v7/evidence/shadow-decision-record-5ac292de1187d29e9d7e2d6d4921ce1e94b41c4332aa10abefa36de3ba37d87f.json"},{"contentHash":"sha256:11132c1068ab43065aad768925a7cf5945f1a39853f4fc3f8559b3cc56ef28a2","path":"/Users/ev/Projects/mihver/.project/run-bundles/authorization-ledger-v1c-r3-architecture-v7/evidence/shadow-seat-attestation-seat-anthropic-11132c1068ab43065aad768925a7cf5945f1a39853f4fc3f8559b3cc56ef28a2.json"},{"contentHash":"sha256:c418fc8498f37a5e081a363193f31b968be9e198550f7651d374b2f4c74ab435","path":"/Users/ev/Projects/mihver/.project/run-bundles/authorization-ledger-v1c-r3-architecture-v7/evidence/shadow-seat-attestation-seat-google-c418fc8498f37a5e081a363193f31b968be9e198550f7651d374b2f4c74ab435.json"},{"contentHash":"sha256:26e4154733481dca8cd1927d5ed6dbd30c737cc2096d8a5c2ec3693b2e6e1d02","path":"/Users/ev/Projects/mihver/.project/run-bundles/authorization-ledger-v1c-r3-architecture-v7/evidence/shadow-seat-attestation-seat-openai-26e4154733481dca8cd1927d5ed6dbd30c737cc2096d8a5c2ec3693b2e6e1d02.json"},{"contentHash":"sha256:95f968873ff7b6f9d8d3ebe2d8c8d2b1a75bcd7189e1262476a7c8c624993ed1","path":"/Users/ev/Projects/mihver/.project/run-bundles/authorization-ledger-v1c-r3-architecture-v7/evidence/shadow-seat-attestation-seat-openai-95f968873ff7b6f9d8d3ebe2d8c8d2b1a75bcd7189e1262476a7c8c624993ed1.json"},{"contentHash":"sha256:a40b1f8c30c2e66dff06700afaaf85f7506766c1920e156fdd368f0d02a9e338","path":"/Users/ev/Projects/mihver/.project/run-bundles/authorization-ledger-v1c-r3-architecture-v7/evidence/shadow-vote-assessment-seat-anthropic-a40b1f8c30c2e66dff06700afaaf85f7506766c1920e156fdd368f0d02a9e338.json"},{"contentHash":"sha256:f9bda8866d8e03ac617131daf93787743304fbd2b81315c0655d1a1a6aeca426","path":"/Users/ev/Projects/mihver/.project/run-bundles/authorization-ledger-v1c-r3-architecture-v7/evidence/shadow-vote-assessment-seat-google-f9bda8866d8e03ac617131daf93787743304fbd2b81315c0655d1a1a6aeca426.json"},{"contentHash":"sha256:f888cf9bb9788c9d5082c695858bbb17ba359b9a9a6b98d942041ecbcb4a89b2","path":"/Users/ev/Projects/mihver/.project/run-bundles/authorization-ledger-v1c-r3-architecture-v7/evidence/shadow-vote-assessment-seat-openai-f888cf9bb9788c9d5082c695858bbb17ba359b9a9a6b98d942041ecbcb4a89b2.json"}],"contextPackBinding":{"branch":"decision/authorization-ledger-v1c-r3-architecture-v7","contextHash":"sha256:7999f772b587226da8637577de934985076bd4404a90c5aa17ce90685c4f1452","detached":false,"head":"2e42febe088e5e6bdff61431cd964dd2a3f2fcd8"},"evidenceManifestRef":{"contentHash":"sha256:d354bf393870c08acb45790a6fea9a22cf9befcbdf57933b21df01c22c7f1524","path":"evidence-manifest.json"},"finalizedAt":"2026-08-30T20:28:37.280Z","manifestHash":"sha256:0b48c8b7f9c72443d60e078b25f957903140c1742acdfcf5a3b5e85c5923e6de","repository":{"name":"mihver","owner":"mihvernetwork","remoteName":"origin"},"runId":"authorization-ledger-v1c-r3-arch-decision-7","status":"FINALIZED","taskRecordRef":{"contentHash":"sha256:74b50d4426833fe7ad924503bee9e0de9262581af644bf0bde352a4798ad1d8c","path":"task-record.json"}}
