{"artifacts":[{"contentHash":"sha256:311fb388aedb4e27de94bf4c227333c1d22f2ac3184b603215827efc8301e0ba","path":"/Users/ev/Projects/mihver/.project/run-bundles/authorization-ledger-v1c-r3-architecture-v6/evidence/shadow-council-packet-seat-anthropic-311fb388aedb4e27de94bf4c227333c1d22f2ac3184b603215827efc8301e0ba.json"},{"contentHash":"sha256:c79b90c194beceae4b0f3c57ebf5d71cc0c48c2eafabf7a9e775ce070b6bd886","path":"/Users/ev/Projects/mihver/.project/run-bundles/authorization-ledger-v1c-r3-architecture-v6/evidence/shadow-council-packet-seat-google-c79b90c194beceae4b0f3c57ebf5d71cc0c48c2eafabf7a9e775ce070b6bd886.json"},{"contentHash":"sha256:c8b4d6412af2d2d9fbe70258c89a7e071e568406d2ed4fd9624badafec455770","path":"/Users/ev/Projects/mihver/.project/run-bundles/authorization-ledger-v1c-r3-architecture-v6/evidence/shadow-council-packet-seat-google-c8b4d6412af2d2d9fbe70258c89a7e071e568406d2ed4fd9624badafec455770.json"},{"contentHash":"sha256:a77aa92683ee7384f8975c1c2ace5605e30b6a38bb9393b6c696ef5cb2b01ce2","path":"/Users/ev/Projects/mihver/.project/run-bundles/authorization-ledger-v1c-r3-architecture-v6/evidence/shadow-council-packet-seat-openai-a77aa92683ee7384f8975c1c2ace5605e30b6a38bb9393b6c696ef5cb2b01ce2.json"},{"contentHash":"sha256:3383112e5b0aabed9445f04b4625898902faba6a9a9d16783779e7ab0b95d2dd","path":"/Users/ev/Projects/mihver/.project/run-bundles/authorization-ledger-v1c-r3-architecture-v6/evidence/shadow-decision-record-3383112e5b0aabed9445f04b4625898902faba6a9a9d16783779e7ab0b95d2dd.json"},{"contentHash":"sha256:ad445fdc4573ff8b1945995a3c2a30de3aaed00a05871e0814d8837f57c4fc7e","path":"/Users/ev/Projects/mihver/.project/run-bundles/authorization-ledger-v1c-r3-architecture-v6/evidence/shadow-seat-attestation-seat-anthropic-ad445fdc4573ff8b1945995a3c2a30de3aaed00a05871e0814d8837f57c4fc7e.json"},{"contentHash":"sha256:68848c00a3ea23a363253c53d86ce77b738122a17180b5035913a99704633154","path":"/Users/ev/Projects/mihver/.project/run-bundles/authorization-ledger-v1c-r3-architecture-v6/evidence/shadow-seat-attestation-seat-google-68848c00a3ea23a363253c53d86ce77b738122a17180b5035913a99704633154.json"},{"contentHash":"sha256:a1446c88d9d1332fdf6d71592425be5a15db91bf736e60b57a0e9758c2cc9207","path":"/Users/ev/Projects/mihver/.project/run-bundles/authorization-ledger-v1c-r3-architecture-v6/evidence/shadow-seat-attestation-seat-google-a1446c88d9d1332fdf6d71592425be5a15db91bf736e60b57a0e9758c2cc9207.json"},{"contentHash":"sha256:0bf81b6651666e421e4ec7f4c5fd1f2e0d00459c79a5b32915b60d0a8fe82427","path":"/Users/ev/Projects/mihver/.project/run-bundles/authorization-ledger-v1c-r3-architecture-v6/evidence/shadow-seat-attestation-seat-openai-0bf81b6651666e421e4ec7f4c5fd1f2e0d00459c79a5b32915b60d0a8fe82427.json"},{"contentHash":"sha256:0cba46102926ccefff9ce132dae4582dd40a2ea7a82e202ca0d22d3c9d605429","path":"/Users/ev/Projects/mihver/.project/run-bundles/authorization-ledger-v1c-r3-architecture-v6/evidence/shadow-vote-assessment-seat-anthropic-0cba46102926ccefff9ce132dae4582dd40a2ea7a82e202ca0d22d3c9d605429.json"},{"contentHash":"sha256:5618e669ed862626dc11634812aac5343dcdc332a4c4985d3a348b5323d3721a","path":"/Users/ev/Projects/mihver/.project/run-bundles/authorization-ledger-v1c-r3-architecture-v6/evidence/shadow-vote-assessment-seat-google-5618e669ed862626dc11634812aac5343dcdc332a4c4985d3a348b5323d3721a.json"},{"contentHash":"sha256:c43b7e261ddda91edbdcd14bba9244d45e9ce5f313f4283275735e34cac6d91d","path":"/Users/ev/Projects/mihver/.project/run-bundles/authorization-ledger-v1c-r3-architecture-v6/evidence/shadow-vote-assessment-seat-openai-c43b7e261ddda91edbdcd14bba9244d45e9ce5f313f4283275735e34cac6d91d.json"}],"contextPackBinding":{"branch":"decision/authorization-ledger-v1c-r3-architecture-v6","contextHash":"sha256:690c3a14648c7f30705de901aa982eefc077cba1f75130f7420b87437e8f49da","detached":false,"head":"f004daa516e87e9e11dfe87023deb4e0302d3e47"},"evidenceManifestRef":{"contentHash":"sha256:c070c6053f5be66446ed51342907ed879020c1eb2320b1a5f959cb3e8a3f99be","path":"evidence-manifest.json"},"finalizedAt":"2026-08-30T19:42:59.740Z","manifestHash":"sha256:5bb995c96422ba75b2f2de0c75061e810ee225a9d24190890c7947e11440e477","repository":{"name":"mihver","owner":"mihvernetwork","remoteName":"origin"},"runId":"authorization-ledger-v1c-r3-arch-decision-6","status":"FINALIZED","taskRecordRef":{"contentHash":"sha256:f1fdee24f9d7ac14badb1e227081e42118420ecce25fca8a0e579afb10582f28","path":"task-record.json"}}
