{"artifacts":[{"contentHash":"sha256:01e4680932b3f7ea1f78b002f13345a41bc818b992010a4a4bb15b5623fad5a3","path":"/Users/ev/Projects/mihver/.project/run-bundles/shadow-council-decision-record-persistence-v1-smoke/evidence/shadow-council-packet-seat-anthropic-01e4680932b3f7ea1f78b002f13345a41bc818b992010a4a4bb15b5623fad5a3.json"},{"contentHash":"sha256:dbf4e577f7ccdd90add2e11bedbdce174f3704586a9cbf8b8a13f0401d7c1f44","path":"/Users/ev/Projects/mihver/.project/run-bundles/shadow-council-decision-record-persistence-v1-smoke/evidence/shadow-council-packet-seat-google-dbf4e577f7ccdd90add2e11bedbdce174f3704586a9cbf8b8a13f0401d7c1f44.json"},{"contentHash":"sha256:b6c013b8d31c1fc4ffa2a36beb04eb2a5987e66b9c009eb4ce87eb24063d58a2","path":"/Users/ev/Projects/mihver/.project/run-bundles/shadow-council-decision-record-persistence-v1-smoke/evidence/shadow-council-packet-seat-openai-b6c013b8d31c1fc4ffa2a36beb04eb2a5987e66b9c009eb4ce87eb24063d58a2.json"},{"contentHash":"sha256:785a120d992bd3c92dcf255417f8280364cc47f0e650b6bf362fd6a65df284b2","path":"/Users/ev/Projects/mihver/.project/run-bundles/shadow-council-decision-record-persistence-v1-smoke/evidence/shadow-decision-record-785a120d992bd3c92dcf255417f8280364cc47f0e650b6bf362fd6a65df284b2.json"},{"contentHash":"sha256:34df675e0e96d28922b507af97bcc6bd4481d56f2dc1b60c734dbe13f06dbb2a","path":"/Users/ev/Projects/mihver/.project/run-bundles/shadow-council-decision-record-persistence-v1-smoke/evidence/shadow-seat-attestation-seat-anthropic-34df675e0e96d28922b507af97bcc6bd4481d56f2dc1b60c734dbe13f06dbb2a.json"},{"contentHash":"sha256:92e4c3cdf5171f37943b5f88457120fa6561e45015394b6554a6edb9ead83713","path":"/Users/ev/Projects/mihver/.project/run-bundles/shadow-council-decision-record-persistence-v1-smoke/evidence/shadow-seat-attestation-seat-google-92e4c3cdf5171f37943b5f88457120fa6561e45015394b6554a6edb9ead83713.json"},{"contentHash":"sha256:ae95d5e5d5af5407a538fb36705cd98d1611af27c292f4b4f706c9128e2e611d","path":"/Users/ev/Projects/mihver/.project/run-bundles/shadow-council-decision-record-persistence-v1-smoke/evidence/shadow-seat-attestation-seat-openai-ae95d5e5d5af5407a538fb36705cd98d1611af27c292f4b4f706c9128e2e611d.json"},{"contentHash":"sha256:0da440ec6cdd33142b8d40ff6d6b02685cb64e47b3d0bef6cfa435574ddc5ae6","path":"/Users/ev/Projects/mihver/.project/run-bundles/shadow-council-decision-record-persistence-v1-smoke/evidence/shadow-vote-assessment-seat-anthropic-0da440ec6cdd33142b8d40ff6d6b02685cb64e47b3d0bef6cfa435574ddc5ae6.json"},{"contentHash":"sha256:b29de75afbb0bbf7fd74c5bb5cc88d21bebf1b33d41a2aa8bd062db7fbd337e4","path":"/Users/ev/Projects/mihver/.project/run-bundles/shadow-council-decision-record-persistence-v1-smoke/evidence/shadow-vote-assessment-seat-google-b29de75afbb0bbf7fd74c5bb5cc88d21bebf1b33d41a2aa8bd062db7fbd337e4.json"}],"contextPackBinding":{"branch":"fix/shadow-council-decision-record-persistence-v1","contextHash":"sha256:f7c9aa4a018243b001475be324bc7d25b1598340e702644febbc7f967591521c","detached":false,"head":"f05d01f766e74abdeaac8e8fe9b6835eb366a83e"},"evidenceManifestRef":{"contentHash":"sha256:97dab344416329a2ba787e3e675ab7987dee5cb1a2b4449691ab5d6a6c7d6bb2","path":"evidence-manifest.json"},"finalizedAt":"2026-08-30T19:25:29.938Z","manifestHash":"sha256:c51e787d1c357b7fd144cbbea31e5e719f2846b488879686c29d8c1acadc7055","repository":{"name":"mihver","owner":"mihvernetwork","remoteName":"origin"},"runId":"shadow-council-decision-record-persistence-v1-smoke-1","status":"FINALIZED","taskRecordRef":{"contentHash":"sha256:a417608358073dff9ddc6e9fe5fb5baa59b03dc9552795a8d5bac112d3a44f3e","path":"task-record.json"}}
