{"artifacts":[{"contentHash":"sha256:f5fce317a6a403767ed0746b2e7413714016e00def31d3d3c3e8912571bb3464","path":".project/run-bundles/shadow-council-v1a-cli-harness-remediated/evidence/exercise-r1.json"},{"contentHash":"sha256:205abef4bdeedd96dced6ca4be1b18dae35df4e295ec19ac3b9a07a46327a663","path":".project/run-bundles/shadow-council-v1a-cli-harness-remediated/evidence/exercise-r2.json"},{"contentHash":"sha256:7b730275f28bc0fa39498bf17a990b9c6a471bddcdddc817145363fbfbc1ca0a","path":"docs/development/SHADOW_COUNCIL_V1A_EXERCISE.md"},{"contentHash":"sha256:a26291f62a4a16569460fa6e7283398de2bcc1feb47df9f3a087ee152ceacb69","path":"package.json"},{"contentHash":"sha256:e28aadc56cca299ab114565af3c862ca61291d6595553cd536a0eed11a6cc97c","path":"schemas/dev/shadow-decision-packet.schema.json"},{"contentHash":"sha256:bfc123ac703f36fb98ffdd71f3b9ed59e0ac3d0db97f917ae2fd05c2195a27a2","path":"schemas/dev/shadow-seat-attestation.schema.json"},{"contentHash":"sha256:9d1c0ea55eb420d01c92acd13d35349423ce2350682d550ec922d98289d744c6","path":"scripts/dev/shadow-council-attestation.mjs"},{"contentHash":"sha256:81404c93b91573d2bef3fef7b98165ad062d3fa151608945ad3767d76ca13eb7","path":"scripts/dev/shadow-council-cli-transport.mjs"},{"contentHash":"sha256:8f05c1bbf8f3ee422ba068036a8392dbbd46b7e78f53affcf971058c9992e04c","path":"scripts/dev/shadow-council-harness.mjs"},{"contentHash":"sha256:fd3f7298ced12c1a5b5d64cbc377ff3b8c9ebf57ed57aeb563322a9ccd067553","path":"scripts/dev/shadow-council-packet.mjs"},{"contentHash":"sha256:54363b9b01cad408d38e20d050174b792c5bac25e438fbf03a31786f6d970500","path":"tests/dev/shadow-council-attestation.test.mjs"},{"contentHash":"sha256:1651e57a20878ebe9d36cbcfbaf12067baf506e983038a825b5124724e03230a","path":"tests/dev/shadow-council-cli-transport.test.mjs"},{"contentHash":"sha256:2f46a50a57ba257ab91cee38582dd8e1c41faa69fca4a80109f82ce5b6ae1592","path":"tests/dev/shadow-council-harness.test.mjs"},{"contentHash":"sha256:b570aeb963f1de0d38181af3859e83fb7d11ed7641c5cf7786b02d052625deb0","path":"tests/dev/shadow-council-packet.test.mjs"}],"contextPackBinding":{"branch":"feat/shadow-council-v1a-cli-harness-remediated","contextHash":"sha256:0baf4a439f4d93c88748c3e70e353414efe5fd7fc83e1244ec290dcd6c850e00","detached":false,"head":"2fae893d89c8debded14fb7ba23adfcad2055133"},"evidenceManifestRef":{"contentHash":"sha256:8e462ce8433bdb8b013e93708ae744f60c8b6a10f3e823cb1f2256bd93c1c34b","path":"evidence-manifest.json"},"finalizedAt":"2026-08-29T21:34:41Z","manifestHash":"sha256:a4ae5777ed0db20cb52e87e6c60606cd912a1d9146ee7322f04fcb82e27c798e","repository":{"name":"mihver","owner":"mihvernetwork","remoteName":"origin"},"runId":"shadow-council-v1a-cli-harness-remediated-finalization-run-1","status":"FINALIZED","taskRecordRef":{"contentHash":"sha256:8b013a58408611f4be0da5774af03679e59552436b406d97c566a1a221e5c159","path":"task-record.json"}}
