{"artifacts":[{"contentHash":"sha256:6dbedb4a178265d5a47a6d4fc4df506504f49a5d2274f9ff211bde43c0e8cf90","path":"/Users/ev/Projects/mihver/.project/run-bundles/shadow-council-contemporaneous-quorum-evidence-v1-smoke/evidence/shadow-council-config-6dbedb4a178265d5a47a6d4fc4df506504f49a5d2274f9ff211bde43c0e8cf90.json"},{"contentHash":"sha256:b29078d1a3fea7dc70c41bef29d6a6e276a254b74776590145f93af4297521de","path":"/Users/ev/Projects/mihver/.project/run-bundles/shadow-council-contemporaneous-quorum-evidence-v1-smoke/evidence/shadow-council-packet-seat-anthropic-b29078d1a3fea7dc70c41bef29d6a6e276a254b74776590145f93af4297521de.json"},{"contentHash":"sha256:eeac0181ffce1dabacfe2e8b948821642954dc721130b67b1ade34ed11e2b35f","path":"/Users/ev/Projects/mihver/.project/run-bundles/shadow-council-contemporaneous-quorum-evidence-v1-smoke/evidence/shadow-council-packet-seat-google-eeac0181ffce1dabacfe2e8b948821642954dc721130b67b1ade34ed11e2b35f.json"},{"contentHash":"sha256:4fb078e49ccdb1f73f4808646452ea82ac17a6ea6a3559c309cbb1915ff7a09a","path":"/Users/ev/Projects/mihver/.project/run-bundles/shadow-council-contemporaneous-quorum-evidence-v1-smoke/evidence/shadow-council-packet-seat-openai-4fb078e49ccdb1f73f4808646452ea82ac17a6ea6a3559c309cbb1915ff7a09a.json"},{"contentHash":"sha256:6d76c476c69a1a5a14adae5104324a5c6be75b7edf26cdaf9ce061fa67ad2069","path":"/Users/ev/Projects/mihver/.project/run-bundles/shadow-council-contemporaneous-quorum-evidence-v1-smoke/evidence/shadow-council-quorum-proof-6d76c476c69a1a5a14adae5104324a5c6be75b7edf26cdaf9ce061fa67ad2069.json"},{"contentHash":"sha256:e380fe743d1854fee6b3ad4693a2f2cd8b121bbbdd29357db75d90d515246119","path":"/Users/ev/Projects/mihver/.project/run-bundles/shadow-council-contemporaneous-quorum-evidence-v1-smoke/evidence/shadow-decision-record-e380fe743d1854fee6b3ad4693a2f2cd8b121bbbdd29357db75d90d515246119.json"},{"contentHash":"sha256:1a8986fd1341e7c2d75a77c129badd7e7a64c4d01a9cd85a27eb3004acb9c37c","path":"/Users/ev/Projects/mihver/.project/run-bundles/shadow-council-contemporaneous-quorum-evidence-v1-smoke/evidence/shadow-decision-request-1a8986fd1341e7c2d75a77c129badd7e7a64c4d01a9cd85a27eb3004acb9c37c.json"},{"contentHash":"sha256:ee4c042828ef95fe25ad7715ed88fa6de36cf5f7e401b63a4c6dc8f14c4ecdab","path":"/Users/ev/Projects/mihver/.project/run-bundles/shadow-council-contemporaneous-quorum-evidence-v1-smoke/evidence/shadow-seat-attestation-seat-anthropic-ee4c042828ef95fe25ad7715ed88fa6de36cf5f7e401b63a4c6dc8f14c4ecdab.json"},{"contentHash":"sha256:e06c331dda9d9866968f7472b2a03fd24bd9b86f42aa7c4a4d542218d13b795e","path":"/Users/ev/Projects/mihver/.project/run-bundles/shadow-council-contemporaneous-quorum-evidence-v1-smoke/evidence/shadow-seat-attestation-seat-google-e06c331dda9d9866968f7472b2a03fd24bd9b86f42aa7c4a4d542218d13b795e.json"},{"contentHash":"sha256:c35b50ac91d8af1a2c3bea49ca0c0b3e36cab8ba90e3d1beff5ed89a27961c87","path":"/Users/ev/Projects/mihver/.project/run-bundles/shadow-council-contemporaneous-quorum-evidence-v1-smoke/evidence/shadow-seat-attestation-seat-openai-c35b50ac91d8af1a2c3bea49ca0c0b3e36cab8ba90e3d1beff5ed89a27961c87.json"},{"contentHash":"sha256:3dbcea38c782583b30b6eb5a776170e70209732773980a0324f0926cab649924","path":"/Users/ev/Projects/mihver/.project/run-bundles/shadow-council-contemporaneous-quorum-evidence-v1-smoke/evidence/shadow-vote-assessment-seat-anthropic-3dbcea38c782583b30b6eb5a776170e70209732773980a0324f0926cab649924.json"},{"contentHash":"sha256:fcebdcd3600d119791534fc01b24832a4d802befbb5802304e7d1027dd70909e","path":"/Users/ev/Projects/mihver/.project/run-bundles/shadow-council-contemporaneous-quorum-evidence-v1-smoke/evidence/shadow-vote-assessment-seat-google-fcebdcd3600d119791534fc01b24832a4d802befbb5802304e7d1027dd70909e.json"}],"contextPackBinding":{"branch":"fix/shadow-council-contemporaneous-quorum-evidence-v1","contextHash":"sha256:3ea1409ace2038188ad0a2417fbcf6ec4106bb60b69ea30a9afb4cbf97ef0594","detached":false,"head":"3b1ec8f30b2e85b3f07e8cfb2b1274038e02c96b"},"evidenceManifestRef":{"contentHash":"sha256:68ef81454b74a1fa7adbbb5a00f27a68a3efe26b3d79a76d501a8661f0a284c9","path":"evidence-manifest.json"},"finalizedAt":"2026-08-31T08:34:28.578Z","manifestHash":"sha256:b0a8ba3faa6bd6124b49aa7a551f57b73b71e0f9baca0e7c148e129f24481e1f","repository":{"name":"mihver","owner":"mihvernetwork","remoteName":"origin"},"runId":"shadow-council-contemporaneous-quorum-evidence-v1-smoke","status":"FINALIZED","taskRecordRef":{"contentHash":"sha256:b2a916df717d02c32ff7008c9676a154d74654ae8f45216f27d79f0876d61e4d","path":"task-record.json"}}
