{"artifacts":[{"contentHash":"sha256:193fc861ba8ef9f1102705f8a69007c2c9fae83117d3da301d489379ad21c8a7","path":"/Users/ev/Projects/mihver/.project/run-bundles/authorization-ledger-v1c-r3-architecture-v8/evidence/shadow-council-config-193fc861ba8ef9f1102705f8a69007c2c9fae83117d3da301d489379ad21c8a7.json"},{"contentHash":"sha256:cde2aa5e427c0c6e616d6063f58eaf15c8808a288ccf54e3986cda5cba56c6fb","path":"/Users/ev/Projects/mihver/.project/run-bundles/authorization-ledger-v1c-r3-architecture-v8/evidence/shadow-council-packet-seat-anthropic-cde2aa5e427c0c6e616d6063f58eaf15c8808a288ccf54e3986cda5cba56c6fb.json"},{"contentHash":"sha256:dae00b861995399becaf56d793e463a8b73f0efa600b1be23ac16372097dbebb","path":"/Users/ev/Projects/mihver/.project/run-bundles/authorization-ledger-v1c-r3-architecture-v8/evidence/shadow-decision-request-dae00b861995399becaf56d793e463a8b73f0efa600b1be23ac16372097dbebb.json"},{"contentHash":"sha256:a242c280a2266b707dca85d8186fa9d9de04cfe65edceaa13906743d8abdba1d","path":"/Users/ev/Projects/mihver/.project/run-bundles/authorization-ledger-v1c-r3-architecture-v8/evidence/shadow-seat-attestation-seat-anthropic-a242c280a2266b707dca85d8186fa9d9de04cfe65edceaa13906743d8abdba1d.json"},{"contentHash":"sha256:15b0d7e9c785f0bd4000ec19df22941c3ef3e50211be6534ae1870160861a1cc","path":"/Users/ev/Projects/mihver/.project/run-bundles/authorization-ledger-v1c-r3-architecture-v8/evidence/shadow-seat-invocation-failure-seat-anthropic-15b0d7e9c785f0bd4000ec19df22941c3ef3e50211be6534ae1870160861a1cc.json"}],"contextPackBinding":{"branch":"decision/authorization-ledger-v1c-r3-architecture-v8","contextHash":"sha256:2c707d7f5846a883402e9191bb06849db66544f3c748c5e6307b1c7ea47db156","detached":false,"head":"245957deab85b3a147ad3b8f38c7645628e30059"},"evidenceManifestRef":{"contentHash":"sha256:c5510e2d72c014b86cc4fa7eee0f659f26d52832ec0832f56e994f7e187d3732","path":"evidence-manifest.json"},"finalizedAt":null,"manifestHash":"sha256:5737aae3d3f8cd8cd20d90d2e817bcd1e8b718b79ac6665490dfcece679edf60","repository":{"name":"mihver","owner":"mihvernetwork","remoteName":"origin"},"runId":"authorization-ledger-v1c-r3-architecture-v8","status":"OPEN","taskRecordRef":{"contentHash":"sha256:1a3a0188b9fbbc11b655f77625fe692085a3d86be775980e8ae89be4e04f7422","path":"task-record.json"}}
