{"artifacts":[{"contentHash":"sha256:e850efc7043d65ae22417e3d751dde350ebad33b0f541dd23870e99e88f1d86f","path":"evidence/shadow-vote-assessment-seat-anthropic-e850efc7043d65ae22417e3d751dde350ebad33b0f541dd23870e99e88f1d86f.json"},{"contentHash":"sha256:9820e2ce7b8ce4ef374f4e27c4b9cc0470c0ff21ee461cdf825524bbe00f6cbf","path":"evidence/shadow-vote-assessment-seat-google-9820e2ce7b8ce4ef374f4e27c4b9cc0470c0ff21ee461cdf825524bbe00f6cbf.json"},{"contentHash":"sha256:de8f40f08662566f6eeff76dbbcc67e1d664a9914f0a14bc26a6e97b3ecf9a5d","path":"evidence/shadow-vote-assessment-seat-openai-de8f40f08662566f6eeff76dbbcc67e1d664a9914f0a14bc26a6e97b3ecf9a5d.json"}],"contextPackBinding":{"branch":"feat/shadow-council-vote-rationale-v1b","contextHash":"sha256:b85acfd63af7281ed155579ef32e39bade10f41dc597004b741632eb7f7ae6f6","detached":false,"head":"2c87a5780e81e832d9074dd2b74401b8a0caf2e6"},"evidenceManifestRef":{"contentHash":"sha256:d62357e79a1b42f789f4f0712b942696dd6df6be076020c57e1ba84476798eb6","path":"evidence-manifest.json"},"finalizedAt":"2026-08-30T12:16:15.930Z","manifestHash":"sha256:43921723a8917eaa7ea962c1e98cbf6e8e6e9093e36ce45e88f96f2e3e343f47","repository":{"name":"mihver","owner":"mihvernetwork","remoteName":"origin"},"runId":"shadow-council-vote-rationale-v1b-smoke-1","status":"FINALIZED","taskRecordRef":{"contentHash":"sha256:dd45e0887b1aaee9aea44437ff91b831e65426723270ff899aa18ded8bf6330f","path":"task-record.json"}}
