{"artifacts":[{"contentHash":"sha256:6eeffa8aef3ac2b26c3bdfd5a73bb06f253360da91411aa2b65908282b3fb80e","path":".project/run-bundles/shadow-council-reviewer-output-reliability-v1-smoke/evidence/shadow-council-packet-seat-anthropic-6eeffa8aef3ac2b26c3bdfd5a73bb06f253360da91411aa2b65908282b3fb80e.json"},{"contentHash":"sha256:af98bd2e5162eb0731b50ef0b1d091c4a2388babac2447e88113296d7e095f94","path":".project/run-bundles/shadow-council-reviewer-output-reliability-v1-smoke/evidence/shadow-council-packet-seat-anthropic-af98bd2e5162eb0731b50ef0b1d091c4a2388babac2447e88113296d7e095f94.json"},{"contentHash":"sha256:b8b16c87d2651b4edeb81f7f46220c174be459e9d19e6babb865d37d90f2936e","path":".project/run-bundles/shadow-council-reviewer-output-reliability-v1-smoke/evidence/shadow-council-packet-seat-google-b8b16c87d2651b4edeb81f7f46220c174be459e9d19e6babb865d37d90f2936e.json"},{"contentHash":"sha256:2cef15e3c5c24832d2231c0db61ed6505462815f6c0288335d2e5abed8ead273","path":".project/run-bundles/shadow-council-reviewer-output-reliability-v1-smoke/evidence/shadow-council-packet-seat-openai-2cef15e3c5c24832d2231c0db61ed6505462815f6c0288335d2e5abed8ead273.json"},{"contentHash":"sha256:46f560e17784a5bc08ab2e5803ae1e2299bec7f7af13dc8be31c2419af590a8f","path":".project/run-bundles/shadow-council-reviewer-output-reliability-v1-smoke/evidence/shadow-seat-attestation-seat-anthropic-46f560e17784a5bc08ab2e5803ae1e2299bec7f7af13dc8be31c2419af590a8f.json"},{"contentHash":"sha256:e010e4c51fd45e4d93b53e601b0436ae6326537c5fd456a6d3e59e7a37763c8c","path":".project/run-bundles/shadow-council-reviewer-output-reliability-v1-smoke/evidence/shadow-seat-attestation-seat-anthropic-e010e4c51fd45e4d93b53e601b0436ae6326537c5fd456a6d3e59e7a37763c8c.json"},{"contentHash":"sha256:7af4db0a4737f850256a76d2196096de7384e12d8034faf6555e63770e147488","path":".project/run-bundles/shadow-council-reviewer-output-reliability-v1-smoke/evidence/shadow-seat-attestation-seat-google-7af4db0a4737f850256a76d2196096de7384e12d8034faf6555e63770e147488.json"},{"contentHash":"sha256:77d09cce1de3f3930a3b17a251b6857587126f90ae4dcfbe9b424645e6f032ee","path":".project/run-bundles/shadow-council-reviewer-output-reliability-v1-smoke/evidence/shadow-seat-attestation-seat-openai-77d09cce1de3f3930a3b17a251b6857587126f90ae4dcfbe9b424645e6f032ee.json"},{"contentHash":"sha256:5bbe8b9be833449b4ea95ae30fdf1c3fbc56ed5a6e3a65361ea75c7ed8ca3ff4","path":".project/run-bundles/shadow-council-reviewer-output-reliability-v1-smoke/evidence/shadow-vote-assessment-seat-anthropic-5bbe8b9be833449b4ea95ae30fdf1c3fbc56ed5a6e3a65361ea75c7ed8ca3ff4.json"},{"contentHash":"sha256:5717fecd1f2b761ddea000470613cfc091d42932880fae670f51e82fa4a69810","path":".project/run-bundles/shadow-council-reviewer-output-reliability-v1-smoke/evidence/shadow-vote-assessment-seat-google-5717fecd1f2b761ddea000470613cfc091d42932880fae670f51e82fa4a69810.json"},{"contentHash":"sha256:928cb3c4fcc69bb2fe233bd806545432c43ff7422908d3c27bbdbf3d721e9301","path":".project/run-bundles/shadow-council-reviewer-output-reliability-v1-smoke/evidence/shadow-vote-assessment-seat-openai-928cb3c4fcc69bb2fe233bd806545432c43ff7422908d3c27bbdbf3d721e9301.json"}],"contextPackBinding":{"branch":"fix/shadow-council-reviewer-output-reliability-v1","contextHash":"sha256:2321912769f8c7f617c15aa2fdd3a7196b7ee9966064c4a794588ebef8c93236","detached":false,"head":"40f2dc3933547a2620ce706330f9086274059c8c"},"evidenceManifestRef":{"contentHash":"sha256:9201b66584b4f22a37787f05381124412f06a9425b492d092f71ec81e3a0bd9a","path":"evidence-manifest.json"},"finalizedAt":"2026-08-30T15:04:16.519Z","manifestHash":"sha256:c8f94f3d19a97ab4b70b520a877205b9dc418ea00998618acb86a7f4995c4923","repository":{"name":"mihver","owner":"mihvernetwork","remoteName":"origin"},"runId":"shadow-council-reviewer-output-reliability-v1-smoke","status":"FINALIZED","taskRecordRef":{"contentHash":"sha256:4c8cfde01c943a1824ec391b895df053c259a3362b1a0165e1db11e46440cec2","path":"task-record.json"}}
