{"artifacts":[{"contentHash":"sha256:cbf891e774bcac237b1d05d6b87aeac738f488c969b4137298d8647f4bd1bf91","path":"/Users/ev/Projects/mihver/.project/run-bundles/authorization-ledger-v1c-r3-architecture-v3/evidence/shadow-council-packet-seat-anthropic-cbf891e774bcac237b1d05d6b87aeac738f488c969b4137298d8647f4bd1bf91.json"},{"contentHash":"sha256:9efb24a442d03cb93f23e59882ec653a45d4bfd39a839e3a8538fe15f8177887","path":"/Users/ev/Projects/mihver/.project/run-bundles/authorization-ledger-v1c-r3-architecture-v3/evidence/shadow-council-packet-seat-google-9efb24a442d03cb93f23e59882ec653a45d4bfd39a839e3a8538fe15f8177887.json"},{"contentHash":"sha256:a292d3131ab6840615c7adc7f47ae6645c2b8af18387ac32bc719128bd0ce1a6","path":"/Users/ev/Projects/mihver/.project/run-bundles/authorization-ledger-v1c-r3-architecture-v3/evidence/shadow-council-packet-seat-openai-a292d3131ab6840615c7adc7f47ae6645c2b8af18387ac32bc719128bd0ce1a6.json"},{"contentHash":"sha256:852a0f8972c67d2e798211432d831f37b9c99ce55a12bde4feee805761847722","path":"/Users/ev/Projects/mihver/.project/run-bundles/authorization-ledger-v1c-r3-architecture-v3/evidence/shadow-seat-attestation-seat-anthropic-852a0f8972c67d2e798211432d831f37b9c99ce55a12bde4feee805761847722.json"},{"contentHash":"sha256:20409bdcbe89fdaff4d19a3576a7194f115b092554ba57901e22090748f19373","path":"/Users/ev/Projects/mihver/.project/run-bundles/authorization-ledger-v1c-r3-architecture-v3/evidence/shadow-seat-attestation-seat-google-20409bdcbe89fdaff4d19a3576a7194f115b092554ba57901e22090748f19373.json"},{"contentHash":"sha256:023db5b2bab697c12dcf4a9154281d83ad354a8732066bc032fd54ad25b5b324","path":"/Users/ev/Projects/mihver/.project/run-bundles/authorization-ledger-v1c-r3-architecture-v3/evidence/shadow-seat-attestation-seat-openai-023db5b2bab697c12dcf4a9154281d83ad354a8732066bc032fd54ad25b5b324.json"},{"contentHash":"sha256:30d342712ec2be6faa551bfa57cb02ed1c2cf006acb63bb3b865cfdedcd27dc1","path":"/Users/ev/Projects/mihver/.project/run-bundles/authorization-ledger-v1c-r3-architecture-v3/evidence/shadow-seat-invocation-failure-seat-anthropic-30d342712ec2be6faa551bfa57cb02ed1c2cf006acb63bb3b865cfdedcd27dc1.json"},{"contentHash":"sha256:088c64de4afcdfcbe118380c3a4552e1f5f48c619858ff1f690a347dfb6d4788","path":"/Users/ev/Projects/mihver/.project/run-bundles/authorization-ledger-v1c-r3-architecture-v3/evidence/shadow-vote-assessment-seat-openai-088c64de4afcdfcbe118380c3a4552e1f5f48c619858ff1f690a347dfb6d4788.json"}],"contextPackBinding":{"branch":"decision/authorization-ledger-v1c-r3-architecture-v3","contextHash":"sha256:e12fd7df3125b5464e02c9005ab14e453c954d49b093c6c22d8eabdad024c380","detached":false,"head":"27da4a0708ad7d0a67c7c96ff65849b467372bd6"},"evidenceManifestRef":{"contentHash":"sha256:09cfc9069b46eef4ef24e8bc2d6d82e2c270dfb857d09a46fcc0592a2975e874","path":"evidence-manifest.json"},"finalizedAt":null,"manifestHash":"sha256:74d1235413f8d8b7e86af9fe9ffa2c482c799b822cb0a0390421f90d6bdace81","repository":{"name":"mihver","owner":"mihvernetwork","remoteName":"origin"},"runId":"authorization-ledger-v1c-r3-architecture-v3","status":"OPEN","taskRecordRef":{"contentHash":"sha256:4e30d017a1660bf3e30ad7b6d43f6da4c953a63fc60314d2d56c474ea79f1b9e","path":"task-record.json"}}
