{"artifacts":[{"contentHash":"sha256:f2e544497c8701f189069b29d22b49688aac6711f04a89dd3c2cd8118f7cad24","path":"/Users/ev/Projects/mihver/.project/run-bundles/authorization-ledger-v1c-r3-architecture-v5/evidence/shadow-council-packet-seat-anthropic-f2e544497c8701f189069b29d22b49688aac6711f04a89dd3c2cd8118f7cad24.json"},{"contentHash":"sha256:9e267f6434c96d71572d8a525f9f7c9f994ae9cd3cc0dac9c6ff7615795c7839","path":"/Users/ev/Projects/mihver/.project/run-bundles/authorization-ledger-v1c-r3-architecture-v5/evidence/shadow-council-packet-seat-google-9e267f6434c96d71572d8a525f9f7c9f994ae9cd3cc0dac9c6ff7615795c7839.json"},{"contentHash":"sha256:5f2c173f22ad4cd7850baaa7417eeb90e619303c651ab838eee41a5a31a0523b","path":"/Users/ev/Projects/mihver/.project/run-bundles/authorization-ledger-v1c-r3-architecture-v5/evidence/shadow-council-packet-seat-openai-5f2c173f22ad4cd7850baaa7417eeb90e619303c651ab838eee41a5a31a0523b.json"},{"contentHash":"sha256:82e53e7266d46d8904b97f1a4c180de1de794d296ba6fe9c481e848a4ff5e79c","path":"/Users/ev/Projects/mihver/.project/run-bundles/authorization-ledger-v1c-r3-architecture-v5/evidence/shadow-council-packet-seat-openai-82e53e7266d46d8904b97f1a4c180de1de794d296ba6fe9c481e848a4ff5e79c.json"},{"contentHash":"sha256:8cc14d0dde5ebe845ea54160fb6419bde1a19b207d4a10f8669d9e2069783e4a","path":"/Users/ev/Projects/mihver/.project/run-bundles/authorization-ledger-v1c-r3-architecture-v5/evidence/shadow-seat-attestation-seat-anthropic-8cc14d0dde5ebe845ea54160fb6419bde1a19b207d4a10f8669d9e2069783e4a.json"},{"contentHash":"sha256:b6cffccf138e20dfde9b066ae92a416a0274061445ba6951f64cd580602861a0","path":"/Users/ev/Projects/mihver/.project/run-bundles/authorization-ledger-v1c-r3-architecture-v5/evidence/shadow-seat-attestation-seat-google-b6cffccf138e20dfde9b066ae92a416a0274061445ba6951f64cd580602861a0.json"},{"contentHash":"sha256:90db26e329deaaf7090f7c13d05528aa0388b35828ed1e0e171393d25c5a81f9","path":"/Users/ev/Projects/mihver/.project/run-bundles/authorization-ledger-v1c-r3-architecture-v5/evidence/shadow-seat-attestation-seat-openai-90db26e329deaaf7090f7c13d05528aa0388b35828ed1e0e171393d25c5a81f9.json"},{"contentHash":"sha256:f928a8416c64e075e7b891461191879ecf2a07d6149a278f1c01d67918c61af0","path":"/Users/ev/Projects/mihver/.project/run-bundles/authorization-ledger-v1c-r3-architecture-v5/evidence/shadow-seat-attestation-seat-openai-f928a8416c64e075e7b891461191879ecf2a07d6149a278f1c01d67918c61af0.json"},{"contentHash":"sha256:7963754dae5a1a4c2e55b94ca9dc79836c8883293b52a85c93a90b565cd52d13","path":"/Users/ev/Projects/mihver/.project/run-bundles/authorization-ledger-v1c-r3-architecture-v5/evidence/shadow-vote-assessment-seat-anthropic-7963754dae5a1a4c2e55b94ca9dc79836c8883293b52a85c93a90b565cd52d13.json"},{"contentHash":"sha256:350b71561fa1045b4fe59df294459d7ca56450960b8b3dc451f2c68ce599840f","path":"/Users/ev/Projects/mihver/.project/run-bundles/authorization-ledger-v1c-r3-architecture-v5/evidence/shadow-vote-assessment-seat-google-350b71561fa1045b4fe59df294459d7ca56450960b8b3dc451f2c68ce599840f.json"},{"contentHash":"sha256:31bc75781c76d0bf1748e58d47bd75d126e055966fb77fada37ed73d404a04f2","path":"/Users/ev/Projects/mihver/.project/run-bundles/authorization-ledger-v1c-r3-architecture-v5/evidence/shadow-vote-assessment-seat-openai-31bc75781c76d0bf1748e58d47bd75d126e055966fb77fada37ed73d404a04f2.json"}],"contextPackBinding":{"branch":"decision/authorization-ledger-v1c-r3-architecture-v5","contextHash":"sha256:cf248bc2b8c25033be600fcd19ebccc804f311668f892ad5e8a9b0fb49b824f8","detached":false,"head":"8bf80782c94029264605e74015582e74eb17e240"},"evidenceManifestRef":{"contentHash":"sha256:7b617165456a5ba7917e514cbcad3b12b0dcdaf8aa4ecc6f4673bfc592086c39","path":"evidence-manifest.json"},"finalizedAt":"2026-08-30T16:59:19.999Z","manifestHash":"sha256:fff5c1a376723cd30b3fac80883d05238397b06d897f2d4b73b2a8628731af46","repository":{"name":"mihver","owner":"mihvernetwork","remoteName":"origin"},"runId":"authorization-ledger-v1c-r3-arch-decision-5","status":"FINALIZED","taskRecordRef":{"contentHash":"sha256:a9bd93b2c254e889139ea8ba4186d4528e8ce962e7378095f7f788598a97a472","path":"task-record.json"}}
