{"artifacts":[{"contentHash":"sha256:0c3c052dded68bc29d70b08098e59deac77363d109ad245ff77181eadcef98b7","path":"/Users/ev/Projects/mihver/.project/run-bundles/authorization-ledger-v1c-r3-architecture-v4/evidence/shadow-council-packet-seat-anthropic-0c3c052dded68bc29d70b08098e59deac77363d109ad245ff77181eadcef98b7.json"},{"contentHash":"sha256:9c9d196b0aab781bb0777e5b2d127fbf8d3d39671c3075b3f50ebdd8aa416580","path":"/Users/ev/Projects/mihver/.project/run-bundles/authorization-ledger-v1c-r3-architecture-v4/evidence/shadow-council-packet-seat-openai-9c9d196b0aab781bb0777e5b2d127fbf8d3d39671c3075b3f50ebdd8aa416580.json"},{"contentHash":"sha256:cab3bd1d3e37eecc694bb8668c86c9dbe9a74ea5705102a25482fff32591721b","path":"/Users/ev/Projects/mihver/.project/run-bundles/authorization-ledger-v1c-r3-architecture-v4/evidence/shadow-council-packet-seat-openai-cab3bd1d3e37eecc694bb8668c86c9dbe9a74ea5705102a25482fff32591721b.json"},{"contentHash":"sha256:e0e9121fc10aa6e14e3dc8a2295670f06fdd7528ee4a61c758e719240b416004","path":"/Users/ev/Projects/mihver/.project/run-bundles/authorization-ledger-v1c-r3-architecture-v4/evidence/shadow-seat-attestation-seat-anthropic-e0e9121fc10aa6e14e3dc8a2295670f06fdd7528ee4a61c758e719240b416004.json"},{"contentHash":"sha256:111982e7124f99db06d1a466da7971fc5b535005fd547eaf535e19440d34b9c2","path":"/Users/ev/Projects/mihver/.project/run-bundles/authorization-ledger-v1c-r3-architecture-v4/evidence/shadow-seat-attestation-seat-openai-111982e7124f99db06d1a466da7971fc5b535005fd547eaf535e19440d34b9c2.json"},{"contentHash":"sha256:8be1fa07b286a6cb011fe7df70a40c67286f6c4cadf02c5cef66e43f0a967cf8","path":"/Users/ev/Projects/mihver/.project/run-bundles/authorization-ledger-v1c-r3-architecture-v4/evidence/shadow-seat-attestation-seat-openai-8be1fa07b286a6cb011fe7df70a40c67286f6c4cadf02c5cef66e43f0a967cf8.json"},{"contentHash":"sha256:86c72d4c03c8a59ba4291a3b7cebd3cd4d26fb742226fb7ed4c17401b88702da","path":"/Users/ev/Projects/mihver/.project/run-bundles/authorization-ledger-v1c-r3-architecture-v4/evidence/shadow-seat-invocation-failure-seat-anthropic-86c72d4c03c8a59ba4291a3b7cebd3cd4d26fb742226fb7ed4c17401b88702da.json"},{"contentHash":"sha256:dae07f340ec6346cfaa517465cad1194f1084dc5f5090d5a550b309131858788","path":"/Users/ev/Projects/mihver/.project/run-bundles/authorization-ledger-v1c-r3-architecture-v4/evidence/shadow-vote-assessment-seat-openai-dae07f340ec6346cfaa517465cad1194f1084dc5f5090d5a550b309131858788.json"}],"contextPackBinding":{"branch":"decision/authorization-ledger-v1c-r3-architecture-v4","contextHash":"sha256:65f384eaedcdd42d677a8f91a5fb0bc7c887c88cfeec431e9c1122ccddc7bf99","detached":false,"head":"9eb19a4fc5c1aa56748e63f29f3d5fea29f711b7"},"evidenceManifestRef":{"contentHash":"sha256:ac78a9a1191e7975e81c192368bce1b01610479683113a2bf4cf9650308d2d27","path":"evidence-manifest.json"},"finalizedAt":null,"manifestHash":"sha256:2cfd266ce7f526e6b5b531a4eea63c8ab4cd7c306025b3608f225fb971588caa","repository":{"name":"mihver","owner":"mihvernetwork","remoteName":"origin"},"runId":"authorization-ledger-v1c-r3-architecture-v4","status":"OPEN","taskRecordRef":{"contentHash":"sha256:9d543a2bc66160f6fdce0cb0e42bd4677a7529ca6f983797231caaefd49c5bb5","path":"task-record.json"}}
