{"artifacts":[{"contentHash":"sha256:489093497f0bda6904cd40349c8a19fc3067657ae7008d54a5f1ec68a1918b24","path":".project/run-bundles/authorization-loop-v1a-demonstration/evidence/demonstration-output.txt"},{"contentHash":"sha256:064f989b0206e5762742fd72f77716a0f006dee1ccfa16a267f7bac0b6181f53","path":"docs/development/AUTHORIZATION_LOOP_V1A_DEMONSTRATION.md"},{"contentHash":"sha256:54db75556aa0109bfd99932988cc52aa1dce6cb591c354443151a8c494610a08","path":"scripts/dev/authorization-loop-demonstration.mjs"}],"contextPackBinding":{"branch":"feat/authorization-loop-foundation-v1a","contextHash":"sha256:6f4ffe46be52e8db1b59c1b9b6f6e3da3385579672c999e98aa1521d7264aa3a","detached":false,"head":"9fe907a87401adae6fe3e4eb443db770dff87678"},"evidenceManifestRef":{"contentHash":"sha256:cc37a745c75c3a756f493b644dfcbf2fe00f17c5d569339531c9bc12e632a94a","path":"evidence-manifest.json"},"finalizedAt":"2026-08-30T10:53:22Z","manifestHash":"sha256:73fa797bee17ea005210833c656913fa91389067afe99208885c403b312f511d","repository":{"name":"mihver","owner":"mihvernetwork","remoteName":"origin"},"runId":"authorization-loop-v1a-demonstration-finalization-run-1","status":"FINALIZED","taskRecordRef":{"contentHash":"sha256:2dd648d53d678f196ed146b0ae781bb108278f9b4761cae9595a9017407f47c6","path":"task-record.json"}}
