{"artifacts":[{"contentHash":"sha256:d34d966b3b24c93dfc1249d02b03271b70053fcbd751a51e1f49310ad04e772c","path":"/Users/ev/Projects/mihver/.project/run-bundles/shadow-council-candidate-gate-reliability-v1-smoke/evidence/shadow-candidate-requirement-spec-d34d966b3b24c93dfc1249d02b03271b70053fcbd751a51e1f49310ad04e772c.json"},{"contentHash":"sha256:063df2fd92754ce7073ef0d9698b6f54c94ca785d0011b27e2dabd5e4cb881f3","path":"/Users/ev/Projects/mihver/.project/run-bundles/shadow-council-candidate-gate-reliability-v1-smoke/evidence/shadow-council-config-063df2fd92754ce7073ef0d9698b6f54c94ca785d0011b27e2dabd5e4cb881f3.json"},{"contentHash":"sha256:efe53b49106c1a93a2c783c837f25d92813db7ba5c055560adf224a5aa47cc92","path":"/Users/ev/Projects/mihver/.project/run-bundles/shadow-council-candidate-gate-reliability-v1-smoke/evidence/shadow-council-packet-seat-anthropic-efe53b49106c1a93a2c783c837f25d92813db7ba5c055560adf224a5aa47cc92.json"},{"contentHash":"sha256:ae15fcdbf1f33cc2797679b75b2630be4f7839e63c921ff6cd53126aec1d6c4d","path":"/Users/ev/Projects/mihver/.project/run-bundles/shadow-council-candidate-gate-reliability-v1-smoke/evidence/shadow-council-packet-seat-google-ae15fcdbf1f33cc2797679b75b2630be4f7839e63c921ff6cd53126aec1d6c4d.json"},{"contentHash":"sha256:0510eefae7f3e817e80fa5cde92c08ee16913896191a91308294cef0fdb9ee17","path":"/Users/ev/Projects/mihver/.project/run-bundles/shadow-council-candidate-gate-reliability-v1-smoke/evidence/shadow-council-packet-seat-openai-0510eefae7f3e817e80fa5cde92c08ee16913896191a91308294cef0fdb9ee17.json"},{"contentHash":"sha256:0738e2c958e769143da6fcbd87940b5348f244924f2f16c64e3222ecd15ffe54","path":"/Users/ev/Projects/mihver/.project/run-bundles/shadow-council-candidate-gate-reliability-v1-smoke/evidence/shadow-council-quorum-proof-0738e2c958e769143da6fcbd87940b5348f244924f2f16c64e3222ecd15ffe54.json"},{"contentHash":"sha256:74bd61538b70fd5a7b52f2e00cbf68f94010752a208946d5717551b61630428b","path":"/Users/ev/Projects/mihver/.project/run-bundles/shadow-council-candidate-gate-reliability-v1-smoke/evidence/shadow-decision-record-74bd61538b70fd5a7b52f2e00cbf68f94010752a208946d5717551b61630428b.json"},{"contentHash":"sha256:eb70146d649a6dba93eeb382646f7262ec013e43ec135ea313a7fdfbf7fe0dec","path":"/Users/ev/Projects/mihver/.project/run-bundles/shadow-council-candidate-gate-reliability-v1-smoke/evidence/shadow-decision-request-eb70146d649a6dba93eeb382646f7262ec013e43ec135ea313a7fdfbf7fe0dec.json"},{"contentHash":"sha256:ae96dc0cb1234d5ba820668b6370416e88c5891de886ad7dc38d3717711a15c1","path":"/Users/ev/Projects/mihver/.project/run-bundles/shadow-council-candidate-gate-reliability-v1-smoke/evidence/shadow-seat-attestation-seat-anthropic-ae96dc0cb1234d5ba820668b6370416e88c5891de886ad7dc38d3717711a15c1.json"},{"contentHash":"sha256:ab1e905565db5a32068e186a2f728225c8f4490bd24182200d6142c5ee8abb1f","path":"/Users/ev/Projects/mihver/.project/run-bundles/shadow-council-candidate-gate-reliability-v1-smoke/evidence/shadow-seat-attestation-seat-google-ab1e905565db5a32068e186a2f728225c8f4490bd24182200d6142c5ee8abb1f.json"},{"contentHash":"sha256:d0ddba4a9c1f39f3d4c7aec02bb3803421c05dea052518b005157eb4d3f1a44f","path":"/Users/ev/Projects/mihver/.project/run-bundles/shadow-council-candidate-gate-reliability-v1-smoke/evidence/shadow-seat-attestation-seat-openai-d0ddba4a9c1f39f3d4c7aec02bb3803421c05dea052518b005157eb4d3f1a44f.json"},{"contentHash":"sha256:a20abc70e6fd2c88a2650172cf0d6d08ea24cc97b5e62e963d990524ca4f89a8","path":"/Users/ev/Projects/mihver/.project/run-bundles/shadow-council-candidate-gate-reliability-v1-smoke/evidence/shadow-unfrozen-proposal-a20abc70e6fd2c88a2650172cf0d6d08ea24cc97b5e62e963d990524ca4f89a8.json"},{"contentHash":"sha256:0394198fbd2c92f3869ae4c445b1325599757faea4be690bc0d787f15a2b55ce","path":"/Users/ev/Projects/mihver/.project/run-bundles/shadow-council-candidate-gate-reliability-v1-smoke/evidence/shadow-vote-assessment-seat-anthropic-0394198fbd2c92f3869ae4c445b1325599757faea4be690bc0d787f15a2b55ce.json"},{"contentHash":"sha256:0414deddad3eeac04c41037e3928efff43d8a67c94a9366c35519ddd29562b4c","path":"/Users/ev/Projects/mihver/.project/run-bundles/shadow-council-candidate-gate-reliability-v1-smoke/evidence/shadow-vote-assessment-seat-google-0414deddad3eeac04c41037e3928efff43d8a67c94a9366c35519ddd29562b4c.json"}],"contextPackBinding":{"branch":"fix/shadow-council-candidate-gate-reliability-v1","contextHash":"sha256:7241f75ed524b9f3f93fc556a99bf082e88d5fccc375904953c6fbe2bbf6fe84","detached":false,"head":"3d90e0eaa9dbd65cd52112c574b1d823c598f0f8"},"evidenceManifestRef":{"contentHash":"sha256:bedfa003c2a49d9b69caf8b66adae2ec4323e3d33fbc9f081f4b2c12510da650","path":"evidence-manifest.json"},"finalizedAt":"2026-08-31T19:40:32.290Z","manifestHash":"sha256:893ba6a63817add517bfd737263bc3689988c0817f82ab2b4e82666663d579a3","repository":{"name":"mihver","owner":"mihvernetwork","remoteName":"origin"},"runId":"shadow-council-candidate-gate-reliability-v1-smoke","status":"FINALIZED","taskRecordRef":{"contentHash":"sha256:417130b58dbd70bc76dba97766308cc9a391dd5c8a79634b4e9ac872630f5366","path":"task-record.json"}}
